{
  "cncf": [
    {
      "category": "pre-release",
      "impact": "새 기능을 빨리 검증하려는 플랫폼 팀은 테스트 클러스터에서 확인할 수 있지만, 짧은 지원 창과 deprecated feature removal 가능성이 명시되어 있어 안정성 우선 환경은 2.3 LTS 유지가 권장된다. upgrade 전 deprecation warning 제거가 필요하다.",
      "published": "2026-09-15",
      "sources": [
        "https://github.com/containerd/containerd/releases/tag/v2.4.0-rc.0",
        "https://github.com/containerd/containerd/releases"
      ],
      "summary": "containerd 2.4.0-rc.0은 2.3 LTS 이후의 일반 release 후보로, CRI image mount manager, OCI runtime feature introspection, resolver auth header hardening, runtime·snapshotter 개선을 포함한다.",
      "tags": [
        "containers",
        "deprecation",
        "release",
        "security"
      ],
      "title": "containerd 2.4.0-rc.0 pre-release",
      "url": "https://github.com/containerd/containerd/releases/tag/v2.4.0-rc.0"
    },
    {
      "category": "patch release",
      "impact": "Argo CD 3.5 계열 운영자는 health 판단과 sync/retry, SSO UI 흐름에서의 회귀 가능성을 줄이기 위해 릴리스 노트를 확인할 만하다. 다른 minor에서 올라오는 경우에는 공식 upgrading 문서 확인이 필요하다.",
      "published": "2026-09-14",
      "sources": [
        "https://github.com/argoproj/argo-cd/releases/tag/v3.5.3",
        "https://github.com/argoproj/argo-cd/releases"
      ],
      "summary": "Argo CD v3.5.3은 KubeVirt VM health, FlinkDeployment health, repository cleanup on revision change, Crossplane managed resource 상태, SSO redirect 401 loop 등 여러 bug fix를 담은 패치 릴리스다.",
      "tags": [
        "gitops",
        "kubernetes",
        "release"
      ],
      "title": "Argo CD v3.5.3 patch release",
      "url": "https://github.com/argoproj/argo-cd/releases/tag/v3.5.3"
    },
    {
      "category": "release candidate",
      "impact": "PromQL range query 비용과 max-samples 제한에 민감한 운영자는 RC에서 쿼리 통계와 결과 변화를 시험해야 한다. 로그 설정은 --log.level 대신 runtime.log_level로 옮기는 준비가 필요하다.",
      "published": "2026-09-14",
      "sources": [
        "https://github.com/prometheus/prometheus/releases/tag/v3.15.0-rc.0",
        "https://github.com/prometheus/prometheus/releases"
      ],
      "summary": "Prometheus 3.15.0-rc.0은 range query의 subquery가 마지막 실제 step 이후까지 평가되어 peakSamples와 storage I/O를 부풀리던 문제 수정, start timestamp reset 처리 변경, log level 플래그 deprecation 등을 포함한다.",
      "tags": [
        "deprecation",
        "observability",
        "performance",
        "release"
      ],
      "title": "Prometheus 3.15.0-rc.0",
      "url": "https://github.com/prometheus/prometheus/releases/tag/v3.15.0-rc.0"
    },
    {
      "category": "release",
      "impact": "Collector component나 extension을 직접 빌드하는 팀은 제거된 API 사용 여부를 확인해야 하며, 설정 스키마와 feature gate 이름 검증 강화로 기존 테스트가 실패할 수 있다. 운영 배포 전 contrib component 호환성 점검이 필요하다.",
      "published": "2026-09-14",
      "sources": [
        "https://github.com/open-telemetry/opentelemetry-collector/releases/tag/v0.161.0",
        "https://github.com/open-telemetry/opentelemetry-collector/releases"
      ],
      "summary": "OpenTelemetry Collector v0.161.0은 deprecated pprofile, scraperhelper, service, xconfmap API 제거와 pdata allocation 개선, schemagen, confmap URI expansion, featuregate ID 검증, pprofile marshaling 버그 수정을 포함한다.",
      "tags": [
        "deprecation",
        "observability",
        "release"
      ],
      "title": "OpenTelemetry Collector v0.161.0",
      "url": "https://github.com/open-telemetry/opentelemetry-collector/releases/tag/v0.161.0"
    }
  ],
  "coverage": {
    "cncf": {
      "note": "2026-09-13부터 2026-09-16까지 CNCF announcements/blog와 주요 CNCF 프로젝트 릴리스를 확인했다. CNCF 공식 announcements/blog에는 해당 3일 창의 새 글이 없었고, GitHub 릴리스에서 containerd, Argo CD, Prometheus, OpenTelemetry 변경 4건을 선별했다.",
      "sources": [
        "https://www.cncf.io/announcements/",
        "https://www.cncf.io/blog/",
        "https://github.com/containerd/containerd/releases",
        "https://github.com/argoproj/argo-cd/releases",
        "https://github.com/prometheus/prometheus/releases",
        "https://github.com/open-telemetry/opentelemetry-collector/releases"
      ],
      "status": "ok"
    },
    "community": {
      "note": "2026-09-13부터 2026-09-16까지 HN top stories와 원문을 중심으로 5건을 선정했다. GeekNews는 403으로 접근이 막혔고 Reddit 상위 글 JSON과 웹 미리보기는 403 또는 빈 응답이라 검토하지 못해 커뮤니티 범위는 부분적이다.",
      "sources": [
        "https://news.ycombinator.com/",
        "https://hacker-news.firebaseio.com/v0/topstories.json",
        "https://news.hada.io/",
        "https://news.hada.io/new",
        "https://www.reddit.com/r/LocalLLaMA/top/?t=week",
        "https://www.reddit.com/r/MachineLearning/top.json?t=week&limit=10",
        "https://www.reddit.com/r/programming/top/?t=week",
        "https://www.reddit.com/r/kubernetes/top.json?t=week&limit=10"
      ],
      "status": "partial"
    },
    "github": {
      "note": "2026-09-09부터 2026-09-16 08:00 KST까지의 GitHub weekly Trending을 2026-09-16 08:00 KST에 확인했고 상위 10개를 모두 기록했다. 첫 관측이므로 신규 진입 여부는 미확정이며, 소개 이력은 이번 호부터 추적합니다.",
      "sources": [
        "https://github.com/trending?since=weekly"
      ],
      "status": "ok"
    },
    "papers": {
      "note": "2026-03-16 이후 최초 공개되고 2026-09-16 이전에 확인 가능한 arXiv cs.AI/cs.CL/cs.LG 최근 항목을 검토해 5편을 선정했다. 직전 7일 소개 이력은 비어 있어 중복 제외로 제거된 논문은 없으며, 본문 전문은 열람하지 못해 모두 초록 근거로만 요약했다.",
      "sources": [
        "https://arxiv.org/list/cs.AI/recent",
        "https://arxiv.org/list/cs.CL/recent",
        "https://export.arxiv.org/api/query?search_query=cat:cs.AI+OR+cat:cs.CL+OR+cat:cs.LG&sortBy=submittedDate&sortOrder=descending&max_results=35"
      ],
      "status": "ok"
    }
  },
  "date": "2026-09-16",
  "discussions": [
    {
      "caveat": "블로그는 자체 early access와 자체 평가 해석을 포함하므로 가격 지속성, 일반 작업 성능, reference probability 기반 workflow eval의 타당성은 독립 검증 전까지 주장으로 봐야 한다. HN 댓글 내용은 제목 수준만 확인됐다.",
      "significance": "HN 상위권 논의로 오른 이유는 LLM을 범용 텍스트 생성기가 아니라 빠른 분기·분류·라우팅 함수로 쓰려는 제품화 방향을 분명히 보여주기 때문이다. 70-500ms, 출력 무료, 확률 보정 같은 주장은 에이전트 내부 판단 비용을 낮추려는 팀에게 직접적인 관심사다.",
      "sources": [
        "https://typesafe.ai/blog/introducing-system-one-models-and-jev",
        "https://news.ycombinator.com/item?id=49717558"
      ],
      "summary": "TypeSafe AI는 문자열 생성 대신 미리 정의된 typed probabilistic decision을 병렬로 반환하는 Jev를 공개하며, 자동화 워크플로에 맞춘 System One Model이라는 포지션을 제시했다.",
      "tags": [
        "agent",
        "developer-tools",
        "inference",
        "llm",
        "performance"
      ],
      "title": "TypeSafe AI가 System One Model과 Jev를 공개",
      "url": "https://typesafe.ai/blog/introducing-system-one-models-and-jev"
    },
    {
      "caveat": "제시된 Speech to Speech Quality Index, tau-Voice, Big Bench Audio 수치는 Google 발표와 링크된 평가를 기반으로 한 것이며, 실제 지연시간·비용·프라이버시는 배포 환경마다 다르다. HN 댓글 본문은 접근 결과 제목만 확인됐다.",
      "significance": "음성·시각 grounding·agentic task completion 벤치마크 수치를 함께 내세운 점은 멀티모달 대화가 단순 채팅에서 실시간 업무 수행 인터페이스로 이동하고 있음을 보여준다. HN에서는 모델 발표의 벤치마크와 실제 체감 품질 사이의 간극이 주요 쟁점이 될 가능성이 높다.",
      "sources": [
        "https://blog.google/innovation-and-ai/models-and-research/gemini-models-gemini-3-8-live-gemini-3-8-live-extended-thinking/",
        "https://news.ycombinator.com/item?id=49715947"
      ],
      "summary": "Google은 실시간 음성 에이전트용 Gemini 3.8 Live와 더 복잡한 다단계 추론을 겨냥한 Extended Thinking 버전을 발표했다.",
      "tags": [
        "agent",
        "inference",
        "llm",
        "multimodal",
        "reasoning"
      ],
      "title": "Google이 Gemini 3.8 Live와 Extended Thinking을 발표",
      "url": "https://blog.google/innovation-and-ai/models-and-research/gemini-models/gemini-3-8-live-gemini-3-8-live-extended-thinking/"
    },
    {
      "caveat": "사건 설명은 Strix 측 블로그와 HN 노출을 기반으로 하며, 일부 저장소명과 고객 관련 정보는 원문에서 가려져 있다. 블로그에 따르면 Baseten은 문제를 확인하고 registry 잠금과 토큰 회전을 수행했지만, 전체 사후조치 범위는 별도 확인이 필요하다.",
      "significance": "컨테이너 이미지 파일시스템뿐 아니라 config history에도 비밀이 남을 수 있다는 점과, 에이전트 기반 recon이 공개 표면에서 공급망 리스크를 빠르게 증명할 수 있음을 보여준다. HN에서도 보안 자동화의 실제 영향과 책임 있는 공개 범위가 논점이다.",
      "sources": [
        "https://www.strix.ai/blog/baseten-harbor-github-pat-takeover",
        "https://news.ycombinator.com/item?id=49716476"
      ],
      "summary": "Strix는 Baseten의 공개 Harbor registry에서 이미지 layer와 build history를 따라가 살아 있는 GitHub PAT를 찾았고, 해당 토큰이 내부 저장소와 GitOps repo에 높은 권한을 가졌다고 공개했다.",
      "tags": [
        "agent",
        "containers",
        "security"
      ],
      "title": "Strix가 공개 Harbor 이미지에서 Baseten GitHub PAT 노출을 분석",
      "url": "https://www.strix.ai/blog/baseten-harbor-github-pat-takeover"
    },
    {
      "caveat": "웹사이트 설명은 제품 가치 제안 중심이며, 보안 sandbox, 파일 형식 안정성, 동시 편집, 모바일 플랫폼 제약은 별도 검증이 필요하다. 클라우드 없는 배포는 협업 기능과 백업 책임을 사용자 쪽으로 옮긴다.",
      "significance": "HN의 Show HN 관심은 작은 도구와 내부 앱을 서버·계정·구독 없이 배포하려는 흐름과 맞닿아 있다. HTML/CSS와 SQLite를 조합해 문서처럼 공유되는 앱을 만들면 개인용 트래커나 포트폴리오 같은 경량 사용처가 넓어진다.",
      "sources": [
        "https://withcapsule.app/",
        "https://news.ycombinator.com/item?id=49712278"
      ],
      "summary": "Capsule은 UI, 미디어 자산, 로컬 데이터베이스를 하나의 .capsule 파일로 묶어 PDF처럼 전달하고 열 수 있게 하는 단일 파일 앱 형식을 제안한다.",
      "tags": [
        "developer-tools",
        "open-source",
        "storage"
      ],
      "title": "Capsule: SQLite 데이터를 품은 단일 파일 웹 앱",
      "url": "https://withcapsule.app/"
    },
    {
      "caveat": "글은 아직 end-user ready가 아니라고 명시하며, clean-room 절차와 공개 실험 저장소를 근거로 제시하지만 장기 유지보수와 커널 통합은 별도 과제다. LLM 기여는 인상적이지만 저자의 수동 판단과 하드웨어 실험 설계가 핵심 병목을 풀었다.",
      "significance": "HN에서 주목받은 이유는 하드웨어 bring-up과 드라이버 개발처럼 긴 시간이 걸리는 시스템 작업에 LLM 보조와 반복 실험이 어떻게 쓰였는지를 구체적으로 보여주기 때문이다. Minecraft 200fps 등 성능 사례는 단순 데모를 넘어 실사용 가능성 논의를 불렀다.",
      "sources": [
        "https://codyho.dev/blog/gpu-driver/",
        "https://news.ycombinator.com/item?id=49717638"
      ],
      "summary": "작성자는 M4 Mac Mini와 MacBook Neo를 대상으로 OpenGL ES 3.0 준수 GPU driver를 약 한 달 안에 만들었고, AGX firmware ABI와 user-space 구성요소를 clean-room 방식으로 역공학했다고 설명했다.",
      "tags": [
        "developer-tools",
        "open-source",
        "performance"
      ],
      "title": "M4 Mac Mini용 Linux GPU driver를 한 달 만에 구현한 사례",
      "url": "https://codyho.dev/blog/gpu-driver/"
    }
  ],